InvoiceNo,StockCode,Description,Quantity,InvoiceDate,UnitPrice,CustomerID,Country
537207,22636,CHILDS BREAKFAST SET CIRCUS PARADE,4,12/5/2010 15:06,8.5,17402.0,United Kingdom
565289,23335,EGG FRYING PAN IVORY ,6,9/2/2011 11:43,2.08,14911.0,EIRE
C558029,20726,LUNCH BAG WOODLAND,-1,6/24/2011 11:47,1.65,12826.0,United Kingdom
536551,84970L,SINGLE HEART ZINC T-LIGHT HOLDER,1,12/1/2010 14:34,0.95,17346.0,United Kingdom
550137,20754,RETROSPOT RED WASHING UP GLOVES,6,4/14/2011 13:59,2.1,12477.0,Germany
544684,21889,WOODEN BOX OF DOMINOES,1,2/22/2011 16:32,2.46,,United Kingdom
549787,22649,STRAWBERRY FAIRY CAKE TEAPOT,2,4/12/2011 11:58,4.95,13268.0,United Kingdom
538636,21527,RED RETROSPOT TRADITIONAL TEAPOT ,2,12/13/2010 13:50,7.95,14639.0,United Kingdom
557642,21094,SET/6 RED SPOTTY PAPER PLATES,2,6/21/2011 16:35,2.46,,United Kingdom
554823,22548,HEADS AND TAILS SPORTING FUN,24,5/26/2011 14:20,1.25,16624.0,United Kingdom
545979,85099F,JUMBO BAG STRAWBERRY,3,3/8/2011 12:30,1.95,12748.0,United Kingdom
539434,21352,EUCALYPTUS & PINECONE  WREATH,1,12/17/2010 14:41,5.91,,United Kingdom
554559,16151A,,-2,5/25/2011 10:28,0.0,,United Kingdom
555592,37342,POLKADOT COFFEE CUP & SAUCER PINK,24,6/6/2011 10:04,0.79,14215.0,United Kingdom
566060,21916,SET 12 RETRO WHITE CHALK STICKS,1,9/8/2011 15:27,0.83,,United Kingdom
C550010,84856S,SMALL TAHITI BEACH BAG,-1,4/14/2011 10:29,3.81,15299.0,United Kingdom
544795,22817,CARD SUKI BIRTHDAY,24,2/23/2011 13:21,0.42,15858.0,United Kingdom
577606,21231,SWEETHEART CERAMIC TRINKET BOX,12,11/21/2011 9:11,1.25,12462.0,Spain
569673,23107,WHITE HEARTS WIRE PLANT POT HOLDER,8,10/5/2011 13:58,2.89,17222.0,United Kingdom
555726,21340,CLASSIC METAL BIRDCAGE PLANT HOLDER,1,6/6/2011 16:23,12.75,12540.0,Spain
537159,22357,KINGS CHOICE BISCUIT TIN,1,12/5/2010 13:17,4.25,14527.0,United Kingdom
571849,22152,PLACE SETTING WHITE STAR,24,10/19/2011 12:52,0.42,12841.0,United Kingdom
561066,23006,TRAVEL CARD WALLET FLOWER MEADOW,4,7/24/2011 14:21,0.42,16710.0,United Kingdom
540122,84819,DANISH ROSE ROUND SEWING BOX,160,1/5/2011 10:39,0.85,13694.0,United Kingdom
564817,22505,MEMO BOARD COTTAGE DESIGN,1,8/30/2011 12:02,10.79,,United Kingdom
538035,37370,RETRO COFFEE MUGS ASSORTED,3,12/9/2010 13:03,1.25,16065.0,United Kingdom
572035,23176,ABC TREASURE BOOK BOX ,72,10/20/2011 12:03,1.95,14646.0,Netherlands
543533,21181,PLEASE ONE PERSON METAL SIGN,2,2/9/2011 13:00,4.13,,United Kingdom
556536,23309,SET OF 60 I LOVE LONDON CAKE CASES ,2,6/13/2011 12:36,0.55,17795.0,United Kingdom
557771,23243,SET OF TEA COFFEE SUGAR TINS PANTRY,4,6/22/2011 14:43,4.95,15601.0,United Kingdom
539647,22467,GUMBALL COAT RACK,2,12/20/2010 16:08,2.55,15460.0,United Kingdom
573934,21770,OPEN CLOSED METAL SIGN,2,11/2/2011 10:36,4.95,17719.0,United Kingdom
571846,21930,JUMBO STORAGE BAG SKULLS,1,10/19/2011 12:35,2.08,17841.0,United Kingdom
542717,22217,T-LIGHT HOLDER HANGING LACE,2,1/31/2011 14:07,1.25,17580.0,United Kingdom
580983,22383,LUNCH BAG SUKI DESIGN ,1,12/6/2011 16:26,4.13,,United Kingdom
552188,21245,GREEN POLKADOT PLATE ,8,5/6/2011 14:01,1.69,12394.0,Belgium
562560,21738,COSY SLIPPER SHOES SMALL  RED ,1,8/5/2011 17:12,2.95,14156.0,EIRE
542622,22722,SET OF 6 SPICE TINS PANTRY DESIGN,1,1/31/2011 9:09,8.29,,United Kingdom
548516,20979,36 PENCILS TUBE RED RETROSPOT,1,3/31/2011 16:28,2.46,,United Kingdom
551269,37342,POLKADOT COFFEE CUP & SAUCER PINK,24,4/27/2011 12:21,0.79,12840.0,United Kingdom
565331,21967,PACK OF 12 SKULL TISSUES,1,9/2/2011 13:59,0.39,16674.0,United Kingdom
576618,22620,4 TRADITIONAL SPINNING TOPS,2,11/15/2011 17:00,2.46,,United Kingdom
567099,84912A,PINK ROSE WASHBAG,1,9/16/2011 13:31,3.75,15311.0,United Kingdom
538205,21062,PARTY INVITES SPACEMAN,2,12/10/2010 11:24,0.85,12748.0,United Kingdom
550304,16237,SLEEPING CAT ERASERS,30,4/17/2011 10:27,0.21,14092.0,United Kingdom
574311,21928,JUMBO BAG SCANDINAVIAN BLUE PAISLEY,10,11/3/2011 16:56,2.08,15640.0,United Kingdom
559693,22031,BOTANICAL LAVENDER BIRTHDAY CARD,5,7/11/2011 16:21,0.42,,United Kingdom
547498,22327,ROUND SNACK BOXES SET OF 4 SKULLS,1,3/23/2011 12:24,2.95,15021.0,United Kingdom
556942,21715,GIRLS VINTAGE TIN SEASIDE BUCKET,8,6/15/2011 16:42,2.55,14222.0,United Kingdom
C539709,84978,HANGING HEART JAR T-LIGHT HOLDER,-1,12/21/2010 12:33,1.25,18176.0,United Kingdom
551211,22776,SWEETHEART CAKESTAND 3 TIER,3,4/27/2011 11:40,9.95,13113.0,United Kingdom
560426,20727,LUNCH BAG  BLACK SKULL.,10,7/18/2011 15:15,1.65,14038.0,United Kingdom
572553,22174,PHOTO CUBE,1,10/24/2011 17:09,3.29,,United Kingdom
545901,16248B,BLUE HOLE PUNCH,2,3/7/2011 17:52,1.25,15834.0,United Kingdom
542708,22934,BAKING MOULD EASTER EGG WHITE CHOC,48,1/31/2011 13:07,2.55,17621.0,United Kingdom
545533,21094,SET/6 RED SPOTTY PAPER PLATES,12,3/3/2011 14:04,0.85,12524.0,Germany
552710,23202,JUMBO BAG VINTAGE LEAF,100,5/11/2011 7:35,1.79,13098.0,United Kingdom
556732,23256,CHILDRENS CUTLERY SPACEBOY ,2,6/14/2011 11:47,4.15,15039.0,United Kingdom
550953,22860,EASTER TIN CHICKS PINK DAISY,1,4/21/2011 16:17,3.29,,United Kingdom
559038,23298,SPOTTY BUNTING,30,7/5/2011 15:31,10.79,,United Kingdom
580964,23273,HEART T-LIGHT HOLDER WILLIE WINKIE,9,12/6/2011 14:50,1.65,15822.0,United Kingdom
555162,22704,WRAP RED APPLES ,25,6/1/2011 10:15,0.42,12473.0,Germany
564304,22094,RED RETROSPOT TISSUE BOX,1,8/24/2011 12:11,0.39,14527.0,United Kingdom
580652,21592,RETROSPOT CIGAR BOX MATCHES ,288,12/5/2011 13:33,0.39,17511.0,United Kingdom
548544,22294,HEART FILIGREE DOVE  SMALL,24,3/31/2011 18:49,1.25,14525.0,United Kingdom
546742,22890,NOVELTY BISCUITS CAKE STAND 3 TIER,2,3/16/2011 12:26,9.95,12849.0,United Kingdom
575367,22736,RIBBON REEL MAKING SNOWMEN ,10,11/9/2011 15:05,1.65,15114.0,United Kingdom
564638,22326,ROUND SNACK BOXES SET OF4 WOODLAND ,6,8/26/2011 12:54,2.95,13812.0,Germany
562649,22241,GARLAND WOODEN HAPPY EASTER,1,8/8/2011 13:11,1.25,14606.0,United Kingdom
562420,22659,LUNCH BOX I LOVE LONDON,1,8/4/2011 16:38,4.13,,United Kingdom
559051,85086A,CANDY SPOT HEART DECORATION,1,7/5/2011 16:47,0.83,,United Kingdom
569336,47590A,BLUE HAPPY BIRTHDAY BUNTING,3,10/3/2011 14:05,5.45,15088.0,United Kingdom
559551,82494L,WOODEN FRAME ANTIQUE WHITE ,2,7/10/2011 16:18,2.95,16877.0,United Kingdom
555149,48184,DOORMAT ENGLISH ROSE ,1,5/31/2011 15:49,15.79,,United Kingdom
576876,85176,SEWING SUSAN 21 NEEDLE SET,1,11/16/2011 16:42,0.85,16804.0,United Kingdom
541292,22195,LARGE HEART MEASURING SPOONS,12,1/17/2011 13:30,1.65,15596.0,United Kingdom
574741,21172,PARTY METAL SIGN ,2,11/6/2011 16:13,1.45,15993.0,United Kingdom
571106,35970,ZINC FOLKART SLEIGH BELLS,6,10/13/2011 16:14,1.69,14976.0,United Kingdom
575975,22578,WOODEN STAR CHRISTMAS SCANDINAVIAN,49,11/13/2011 13:18,0.29,13536.0,United Kingdom
576215,23444,Next Day Carriage,1,11/14/2011 12:55,15.0,17652.0,United Kingdom
556204,82482,WOODEN PICTURE FRAME WHITE FINISH,6,6/9/2011 13:16,2.55,17169.0,United Kingdom
547686,84380,SET OF 3 BUTTERFLY COOKIE CUTTERS,12,3/24/2011 14:49,1.25,15513.0,United Kingdom
558777,23171,REGENCY TEA PLATE GREEN ,1,7/4/2011 10:23,3.29,,United Kingdom
576096,22423,REGENCY CAKESTAND 3 TIER,2,11/14/2011 9:20,12.75,13549.0,United Kingdom
562553,82582,AREA PATROLLED METAL SIGN,1,8/5/2011 16:34,4.13,,United Kingdom
551876,84879,ASSORTED COLOUR BIRD ORNAMENT,16,5/5/2011 8:18,1.69,14867.0,United Kingdom
565870,POST,POSTAGE,1,9/7/2011 15:10,15.0,16828.0,United Kingdom
574965,22491,PACK OF 12 COLOURED PENCILS,2,11/8/2011 10:44,0.85,17964.0,United Kingdom
564184,23170,REGENCY TEA PLATE ROSES ,12,8/23/2011 15:11,1.65,,EIRE
559042,22844,VINTAGE CREAM DOG FOOD CONTAINER,1,7/5/2011 15:34,16.63,,United Kingdom
555925,20980,36 PENCILS TUBE POSY,2,6/7/2011 17:13,0.83,,United Kingdom
564842,23348,CHILDRENS TOY COOKING UTENSIL SET,36,8/30/2011 13:47,1.79,16133.0,United Kingdom
578995,21211,SET OF 72 SKULL PAPER  DOILIES,2,11/27/2011 15:59,1.45,15861.0,United Kingdom
558774,21620,SET OF 4 ROSE BOTANICAL CANDLES,1,7/4/2011 10:17,2.46,,United Kingdom
551339,21385,IVORY HANGING DECORATION  HEART,1,4/27/2011 17:18,1.63,,United Kingdom
581400,22720,SET OF 3 CAKE TINS PANTRY DESIGN ,2,12/8/2011 13:36,4.95,14056.0,United Kingdom
563944,47566,PARTY BUNTING,4,8/22/2011 10:08,4.95,17581.0,United Kingdom
575070,20668,DISCO BALL CHRISTMAS DECORATION,72,11/8/2011 12:58,0.12,17841.0,United Kingdom
546427,84692,BOX OF 24 COCKTAIL PARASOLS,3,3/13/2011 14:29,0.42,14606.0,United Kingdom
549953,22851,SET 20 NAPKINS FAIRY CAKES DESIGN ,24,4/13/2011 13:15,0.85,12766.0,Portugal
540691,22413,METAL SIGN TAKE IT OR LEAVE IT ,12,1/11/2011 8:50,3.21,17450.0,United Kingdom
573116,23162,REGENCY TEA STRAINER,1,10/27/2011 15:49,3.75,14525.0,United Kingdom
573909,23405,HOME SWEET HOME 2 DRAWER CABINET,4,11/1/2011 15:26,4.95,17813.0,United Kingdom
545830,21911,GARDEN METAL SIGN ,2,3/7/2011 13:10,1.65,17634.0,United Kingdom
548327,21931,JUMBO STORAGE BAG SUKI,2,3/30/2011 13:05,2.08,16788.0,United Kingdom
550279,21670,BLUE SPOT CERAMIC DRAWER KNOB,12,4/15/2011 13:16,1.25,14700.0,United Kingdom
547967,21991,BOHEMIAN COLLAGE STATIONERY SET,1,3/28/2011 15:49,2.46,,United Kingdom
562608,23297,SET 40 HEART SHAPE PETIT FOUR CASES,16,8/8/2011 11:45,1.65,15502.0,United Kingdom
541280,21232,STRAWBERRY CERAMIC TRINKET BOX,72,1/17/2011 11:57,1.06,15296.0,United Kingdom
552310,23200,JUMBO BAG PEARS,2,5/8/2011 15:22,2.08,17323.0,United Kingdom
562106,20828,GLITTER BUTTERFLY CLIPS,1,8/2/2011 15:19,2.55,14076.0,United Kingdom
575040,23245,SET OF 3 REGENCY CAKE TINS,4,11/8/2011 11:58,4.95,13381.0,United Kingdom
546398,22722,SET OF 6 SPICE TINS PANTRY DESIGN,4,3/11/2011 14:52,3.95,13043.0,United Kingdom
541592,84596F,SMALL MARSHMALLOWS PINK BOWL,11,1/19/2011 15:08,0.83,,United Kingdom
564093,23207,LUNCH BAG ALPHABET DESIGN,10,8/23/2011 10:29,1.65,14930.0,Channel Islands
544691,22966,GINGERBREAD MAN COOKIE CUTTER,12,2/23/2011 9:09,1.25,13804.0,United Kingdom
541421,21913,VINTAGE SEASIDE JIGSAW PUZZLES,3,1/17/2011 17:44,3.29,,United Kingdom
574654,21949,SET OF 6 STRAWBERRY CHOPSTICKS,1,11/6/2011 11:32,1.25,15571.0,United Kingdom
549524,22644,CERAMIC CHERRY CAKE MONEY BANK,1,4/8/2011 15:42,3.29,,United Kingdom
552726,22561,WOODEN SCHOOL COLOURING SET,12,5/11/2011 10:31,1.65,14920.0,United Kingdom
558774,23200,JUMBO BAG PEARS,9,7/4/2011 10:17,2.08,,United Kingdom
579293,23236,STORAGE TIN VINTAGE DOILY ,2,11/29/2011 11:22,2.89,14419.0,United Kingdom
554162,21497,FANCY FONTS BIRTHDAY WRAP,25,5/23/2011 11:52,0.42,16722.0,United Kingdom
540026,21313,GLASS HEART T-LIGHT HOLDER ,1,1/4/2011 13:25,1.66,,United Kingdom
581439,21314,SMALL GLASS HEART TRINKET POT,2,12/8/2011 16:30,4.13,,United Kingdom
567200,16218,CARTOON  PENCIL SHARPENERS,80,9/19/2011 10:15,0.06,16460.0,United Kingdom
579297,21216,"SET 3 RETROSPOT TEA,COFFEE,SUGAR",4,11/29/2011 11:23,10.79,,United Kingdom
560732,23052,RECYCLED ACAPULCO MAT TURQUOISE,3,7/20/2011 14:55,8.25,14056.0,United Kingdom
578067,DOT,DOTCOM POSTAGE,1,11/22/2011 15:43,416.48,,United Kingdom
555736,16161P,WRAP ENGLISH ROSE ,25,6/7/2011 9:13,0.42,17730.0,United Kingdom
578045,23300,GARDENERS KNEELING PAD CUP OF TEA ,1,11/22/2011 14:43,1.65,17297.0,United Kingdom
538566,22295,HEART FILIGREE DOVE LARGE,3,12/13/2010 11:21,3.36,,United Kingdom
555979,22470,HEART OF WICKER LARGE,2,6/8/2011 11:18,2.95,15039.0,United Kingdom
566923,22507,MEMO BOARD RETROSPOT  DESIGN,1,9/15/2011 15:05,4.95,15511.0,United Kingdom
539240,22700,BLACK AND WHITE DOG BOWL,24,12/16/2010 13:15,0.85,15194.0,United Kingdom
538901,84378,SET OF 3 HEART COOKIE CUTTERS,12,12/15/2010 9:58,1.25,17629.0,United Kingdom
566300,22696,WICKER WREATH LARGE,6,9/11/2011 16:05,1.95,18215.0,United Kingdom
580030,22847,BREAD BIN DINER STYLE IVORY,1,12/1/2011 12:14,16.95,12951.0,United Kingdom
540352,84251B,"GREETING CARD, STICKY GORDON",2,1/6/2011 14:27,0.43,,United Kingdom
551163,21507,"ELEPHANT, BIRTHDAY CARD, ",12,4/26/2011 15:52,0.42,12573.0,France
563549,23141,TRIPLE WIRE HOOK PINK HEART,1,8/17/2011 12:34,8.29,,United Kingdom
549901,23054,RECYCLED ACAPULCO MAT LAVENDER,1,4/12/2011 16:17,8.25,17180.0,United Kingdom
555015,22784,LANTERN CREAM GAZEBO ,3,5/31/2011 10:45,4.95,16558.0,United Kingdom
574909,22620,4 TRADITIONAL SPINNING TOPS,1,11/7/2011 15:40,1.45,13673.0,United Kingdom
576899,84926A,WAKE UP COCKEREL TILE COASTER,24,11/17/2011 8:49,0.29,14911.0,EIRE
558263,23020,GLASS SONGBIRD STORAGE JAR,8,6/28/2011 8:50,11.15,14646.0,Netherlands
580047,20970,PINK FLORAL FELTCRAFT SHOULDER BAG,2,12/1/2011 12:44,3.75,12989.0,United Kingdom
557248,22169,FAMILY ALBUM WHITE PICTURE FRAME,2,6/17/2011 15:22,8.5,14491.0,United Kingdom
577859,22865,HAND WARMER OWL DESIGN,2,11/22/2011 11:24,2.1,14534.0,United Kingdom
537638,21787,RAIN PONCHO RETROSPOT,2,12/7/2010 15:28,1.66,,United Kingdom
536975,20982,12 PENCILS TALL TUBE SKULLS,12,12/3/2010 14:04,0.85,14911.0,EIRE
579550,22223,CAKE PLATE LOVEBIRD PINK,3,11/30/2011 10:48,4.95,12630.0,Finland
559878,22413,METAL SIGN TAKE IT OR LEAVE IT ,1,7/13/2011 11:19,2.95,15493.0,United Kingdom
571669,21485,RETROSPOT HEART HOT WATER BOTTLE,3,10/18/2011 13:11,4.95,17758.0,United Kingdom
568193,23158,SET OF 5 LUCKY CAT MAGNETS ,120,9/25/2011 14:37,1.85,17107.0,United Kingdom
557630,20712,JUMBO BAG WOODLAND ANIMALS,10,6/21/2011 14:53,2.08,13178.0,United Kingdom
573923,21202,DOLLY HONEYCOMB GARLAND,1,11/2/2011 9:31,1.65,17965.0,United Kingdom
538015,21696,SMALL SILVER TRELLIS CANDLEPOT,6,12/9/2010 12:49,2.95,13240.0,United Kingdom
570019,21561,DINOSAUR LUNCH BOX WITH CUTLERY,1,10/7/2011 10:13,2.55,17841.0,United Kingdom
566326,20972,PINK CREAM FELT CRAFT TRINKET BOX ,12,9/12/2011 12:11,1.25,16211.0,United Kingdom
554112,90162C,ANT SILVER FUSCHIA BOUDICCA RING,1,5/22/2011 14:44,2.95,17611.0,United Kingdom
580397,23300,GARDENERS KNEELING PAD CUP OF TEA ,1,12/4/2011 11:24,1.65,13558.0,United Kingdom
573585,22713,CARD I LOVE LONDON ,1,10/31/2011 14:41,0.83,,United Kingdom
566186,21986,PACK OF 12 PINK POLKADOT TISSUES,24,9/9/2011 13:02,0.39,16603.0,United Kingdom
569372,23559,WOODLAND BUNNIES LOLLY MAKERS,3,10/3/2011 16:04,4.13,,United Kingdom
C546730,22720,SET OF 3 CAKE TINS PANTRY DESIGN ,-1,3/16/2011 11:39,4.95,18183.0,United Kingdom
580515,21810,CHRISTMAS HANGING STAR WITH BELL,1,12/4/2011 14:09,0.39,17750.0,United Kingdom
542141,21733,RED HANGING HEART T-LIGHT HOLDER,32,1/26/2011 8:38,2.55,14548.0,United Kingdom
559689,23102,SILVER HEARTS TABLE DECORATION,1,7/11/2011 15:46,0.83,,United Kingdom
552492,21137,BLACK RECORD COVER FRAME,24,5/9/2011 16:02,3.39,12888.0,United Kingdom
540468,21352,EUCALYPTUS & PINECONE  WREATH,2,1/7/2011 13:55,5.91,,United Kingdom
561909,21915,RED  HARMONICA IN BOX ,48,8/1/2011 10:23,1.25,15625.0,United Kingdom
539654,22560,TRADITIONAL MODELLING CLAY,24,12/20/2010 17:05,1.25,17340.0,United Kingdom
559733,23306,SET OF 36 DOILIES PANTRY DESIGN,12,7/12/2011 10:54,1.45,16145.0,United Kingdom
546753,16156S,WRAP PINK FAIRY CAKES ,25,3/16/2011 13:00,0.42,16383.0,United Kingdom
541424,84968F,SET OF 16 VINTAGE SKY BLUE CUTLERY,2,1/17/2011 17:57,8.29,,United Kingdom
566571,21169,YOU'RE CONFUSING ME METAL SIGN ,12,9/13/2011 12:49,1.69,17037.0,United Kingdom
561113,20971,PINK BLUE FELT CRAFT TRINKET BOX,10,7/25/2011 12:09,1.25,17841.0,United Kingdom
544599,22115,METAL SIGN EMPIRE TEA,1,2/21/2011 18:15,5.79,,United Kingdom
540821,22902,TOTE BAG I LOVE LONDON,1,1/11/2011 13:16,4.21,,United Kingdom
574080,23506,MINI PLAYING CARDS SPACEBOY ,6,11/2/2011 16:29,0.42,16348.0,United Kingdom
580727,85014A,BLACK/BLUE POLKADOT UMBRELLA,1,12/5/2011 17:17,12.46,14096.0,United Kingdom
581456,23329,DECORATIVE WICKER HEART LARGE,3,12/8/2011 18:42,1.65,17530.0,United Kingdom
549790,22149,FELTCRAFT 6 FLOWER FRIENDS,6,4/12/2011 12:02,2.1,16172.0,United Kingdom
557801,23014,GLASS APOTHECARY BOTTLE ELIXIR,4,6/23/2011 10:14,3.95,13319.0,United Kingdom
567509,84991,60 TEATIME FAIRY CAKE CASES,24,9/20/2011 14:51,0.42,14298.0,United Kingdom
C548356,21559,STRAWBERRY LUNCH BOX WITH CUTLERY,-3,3/30/2011 15:12,2.55,12472.0,Germany
578262,22910,PAPER CHAIN KIT VINTAGE CHRISTMAS,2,11/23/2011 13:27,2.95,18283.0,United Kingdom
553585,22983,CARD BILLBOARD FONT,12,5/18/2011 10:41,0.42,15301.0,United Kingdom
559542,23270,SET OF 2 CERAMIC PAINTED HEARTS ,6,7/10/2011 13:32,1.45,17126.0,United Kingdom
537409,22867,HAND WARMER BIRD DESIGN,12,12/6/2010 15:00,2.1,15194.0,United Kingdom
569826,23198,PANTRY MAGNETIC  SHOPPING LIST,12,10/6/2011 12:25,1.45,18161.0,United Kingdom
543660,22624,IVORY KITCHEN SCALES,1,2/11/2011 10:40,16.63,,United Kingdom
538071,84674,FLYING PIG WATERING CAN,1,12/9/2010 14:09,5.91,,United Kingdom
536528,22911,PAPER CHAIN KIT LONDON,1,12/1/2010 13:17,2.95,15525.0,United Kingdom
539580,22716,CARD CIRCUS PARADE,12,12/20/2010 12:51,0.42,15312.0,United Kingdom
581217,23197,SKETCHBOOK MAGNETIC SHOPPING LIST,7,12/8/2011 9:20,3.29,,United Kingdom
574695,21755,LOVE BUILDING BLOCK WORD,1,11/6/2011 13:37,6.25,17114.0,United Kingdom
558922,21936,RED RETROSPOT PICNIC BAG,5,7/5/2011 10:06,2.95,16782.0,United Kingdom
577358,22162,HEART GARLAND RUSTIC PADDED,1,11/18/2011 15:59,3.29,,United Kingdom
573553,22297,HEART IVORY TRELLIS SMALL,1,10/31/2011 13:48,2.46,,United Kingdom
550918,22926,IVORY GIANT GARDEN THERMOMETER,2,4/21/2011 14:03,5.95,17630.0,United Kingdom
561325,47590B,PINK HAPPY BIRTHDAY BUNTING,2,7/26/2011 13:46,5.45,17596.0,United Kingdom
555149,21084,SET/6 COLLAGE PAPER CUPS,3,5/31/2011 15:49,0.83,,United Kingdom
564835,20982,12 PENCILS TALL TUBE SKULLS,1,8/30/2011 12:31,1.63,,United Kingdom
566005,82552,WASHROOM METAL SIGN,1,9/8/2011 11:56,1.45,16426.0,United Kingdom
546486,22084,PAPER CHAIN KIT EMPIRE,8,3/14/2011 11:41,2.95,15039.0,United Kingdom
569007,22749,FELTCRAFT PRINCESS CHARLOTTE DOLL,8,9/29/2011 18:51,3.75,17552.0,United Kingdom
545078,22189,CREAM HEART CARD HOLDER,1,2/28/2011 10:15,8.29,,United Kingdom
569357,23532,WALL ART WORK REST AND PLAY  ,3,10/3/2011 14:52,4.95,15930.0,United Kingdom
569217,22553,PLASTERS IN TIN SKULLS,1,10/2/2011 12:45,1.65,15579.0,United Kingdom
581516,22111,SCOTTIE DOG HOT WATER BOTTLE,6,12/9/2011 11:26,4.95,14422.0,United Kingdom
C556647,20750,RED RETROSPOT MINI CASES,-2,6/13/2011 16:14,7.95,13012.0,United Kingdom
579777,22477,WATERING CAN GARDEN MARKER,2,11/30/2011 15:13,2.46,,United Kingdom
543631,22023,EMPIRE BIRTHDAY CARD,12,2/10/2011 16:17,0.42,14081.0,United Kingdom
557153,22607,WOODEN ROUNDERS GARDEN SET ,2,6/17/2011 11:07,9.95,13735.0,United Kingdom
553879,21891,TRADITIONAL WOODEN SKIPPING ROPE,12,5/19/2011 15:15,1.45,15791.0,United Kingdom
552835,22089,PAPER BUNTING VINTAGE PAISLEY,6,5/11/2011 14:17,2.95,17664.0,United Kingdom
565129,20685,DOORMAT RED RETROSPOT,1,9/1/2011 12:41,8.25,15719.0,United Kingdom
552640,22271,FELTCRAFT DOLL ROSIE,1,5/10/2011 13:19,2.95,17841.0,United Kingdom
578211,22209,WOOD STAMP SET HAPPY BIRTHDAY,1,11/23/2011 11:47,0.83,12748.0,United Kingdom
578347,22983,CARD BILLBOARD FONT,3,11/24/2011 9:26,0.83,,United Kingdom
576051,23286,BLUE VINTAGE SPOT BEAKER,8,11/13/2011 14:45,0.85,14911.0,EIRE
558700,22355,CHARLOTTE BAG SUKI DESIGN,10,7/1/2011 12:33,0.85,17920.0,United Kingdom
579267,22909,SET OF 20 VINTAGE CHRISTMAS NAPKINS,24,11/29/2011 9:42,0.85,14961.0,United Kingdom
579512,90003C,MIDNIGHT BLUE PAIR HEART HAIR SLIDE,2,11/29/2011 16:47,3.73,,United Kingdom
552265,22980,PANTRY SCRUBBING BRUSH,1,5/8/2011 11:41,1.65,14161.0,United Kingdom
562843,22726,ALARM CLOCK BAKELIKE GREEN,1,8/9/2011 17:37,7.46,,United Kingdom
570677,22730,ALARM CLOCK BAKELIKE IVORY,3,10/11/2011 15:10,3.75,12836.0,United Kingdom
559134,22637,PIGGY BANK RETROSPOT ,8,7/6/2011 13:14,2.55,12700.0,France
567818,23329,DECORATIVE WICKER HEART LARGE,6,9/22/2011 12:41,1.65,14395.0,United Kingdom
545317,22619,SET OF 6 SOLDIER SKITTLES,1,3/1/2011 14:14,7.46,,United Kingdom
569491,22725,ALARM CLOCK BAKELIKE CHOCOLATE,2,10/4/2011 13:25,3.75,14056.0,United Kingdom
573553,21232,STRAWBERRY CERAMIC TRINKET POT,9,10/31/2011 13:48,2.46,,United Kingdom
568346,22739,RIBBON REEL CHRISTMAS SOCK BAUBLE,6,9/26/2011 15:28,3.29,14096.0,United Kingdom
576617,21314,SMALL GLASS HEART TRINKET POT,2,11/15/2011 16:57,4.13,,United Kingdom
544077,20771,CHRYSANTHEMUM  JOURNAL,1,2/15/2011 15:04,2.55,14825.0,United Kingdom
571716,23534,WALL ART STOP FOR TEA ,1,10/18/2011 17:05,12.46,,United Kingdom
561329,22423,REGENCY CAKESTAND 3 TIER,2,7/26/2011 13:57,12.75,15044.0,United Kingdom
561857,21790,VINTAGE SNAP CARDS,12,7/29/2011 16:24,0.85,13004.0,United Kingdom
540458,20727,LUNCH BAG  BLACK SKULL.,10,1/7/2011 12:28,1.65,12501.0,Germany
573576,85049E,SCANDINAVIAN REDS RIBBONS,9,10/31/2011 14:09,2.46,14096.0,United Kingdom
551533,22485,SET OF 2 WOODEN MARKET CRATES,1,5/1/2011 14:58,12.75,15407.0,United Kingdom
569202,22547,MINI JIGSAW DINOSAUR ,3,9/30/2011 17:22,0.83,,United Kingdom
553393,22497,SET OF 2 TINS VINTAGE BATHROOM ,1,5/16/2011 16:46,8.29,,United Kingdom
543393,20716,PARTY FOOD SHOPPER BAG,10,2/8/2011 10:17,1.25,13534.0,United Kingdom
553845,21535,RED RETROSPOT SMALL MILK JUG,6,5/19/2011 12:38,2.55,17675.0,United Kingdom
574561,22573,STAR WOODEN CHRISTMAS DECORATION,2,11/4/2011 15:52,1.63,,United Kingdom
573362,85066,CREAM SWEETHEART MINI CHEST,2,10/30/2011 13:06,12.75,12597.0,Spain
551953,22697,GREEN REGENCY TEACUP AND SAUCER,6,5/5/2011 11:53,2.95,13448.0,United Kingdom
563018,22219,LOVEBIRD HANGING DECORATION WHITE ,12,8/11/2011 12:53,0.85,13427.0,United Kingdom
543411,22342,HOME GARLAND PAINTED ZINC ,12,2/8/2011 11:31,1.65,12576.0,Poland
566451,22507,MEMO BOARD RETROSPOT  DESIGN,1,9/12/2011 16:14,4.95,18069.0,United Kingdom
572031,21192,WHITE BELL HONEYCOMB PAPER ,96,10/20/2011 11:53,1.45,14866.0,United Kingdom
540093,15056BL,EDWARDIAN PARASOL BLACK,1,1/4/2011 15:24,5.95,16725.0,United Kingdom
572695,21989,PACK OF 20 SKULL PAPER NAPKINS,12,10/25/2011 14:23,0.85,12610.0,Italy
540348,22263,FELT EGG COSY LADYBIRD ,4,1/6/2011 13:56,0.85,12841.0,United Kingdom
556781,84879,ASSORTED COLOUR BIRD ORNAMENT,36,6/14/2011 12:47,1.69,13384.0,United Kingdom
537641,22187,GREEN CHRISTMAS TREE CARD HOLDER,2,12/7/2010 15:32,8.47,,United Kingdom
561868,22382,LUNCH BAG SPACEBOY DESIGN ,3,7/31/2011 11:26,1.65,16813.0,United Kingdom
542932,21447,12 IVORY ROSE PEG PLACE SETTINGS,12,2/2/2011 10:54,1.25,13089.0,United Kingdom
577101,20969,RED FLORAL FELTCRAFT SHOULDER BAG,4,11/17/2011 16:51,3.75,13138.0,United Kingdom
555009,82484,WOOD BLACK BOARD ANT WHITE FINISH,12,5/31/2011 10:32,6.75,17340.0,United Kingdom
555518,22380,TOY TIDY SPACEBOY  ,5,6/5/2011 10:58,2.1,14891.0,United Kingdom
542231,72741,GRAND CHOCOLATECANDLE,18,1/26/2011 13:40,1.45,16714.0,United Kingdom
537131,22470,HEART OF WICKER LARGE,5,12/5/2010 12:26,2.95,15716.0,United Kingdom
575678,22939,ADULT APRON APPLE DELIGHT,4,11/10/2011 15:23,4.95,16169.0,United Kingdom
566193,22282,12 EGG HOUSE PAINTED WOOD,2,9/9/2011 13:37,12.75,14961.0,United Kingdom
572668,23128,FELTCRAFT BOY JEAN-PAUL KIT,1,10/25/2011 13:07,4.95,18045.0,United Kingdom
545658,22544,MINI JIGSAW SPACEBOY,12,3/4/2011 14:13,0.42,14670.0,United Kingdom
562377,22794,SWEETHEART WIRE MAGAZINE RACK,1,8/4/2011 15:04,7.95,14535.0,United Kingdom
551436,22372,AIRLINE BAG VINTAGE WORLD CHAMPION ,1,4/28/2011 15:13,4.25,16904.0,United Kingdom
571441,85049E,SCANDINAVIAN REDS RIBBONS,3,10/17/2011 13:31,2.46,14096.0,United Kingdom
579777,22567,20 DOLLY PEGS RETROSPOT,1,11/30/2011 15:13,2.92,,United Kingdom
565851,22320,BIRDS MOBILE VINTAGE DESIGN,6,9/7/2011 13:06,5.95,14911.0,EIRE
553048,22149,FELTCRAFT 6 FLOWER FRIENDS,6,5/13/2011 10:02,2.1,14291.0,United Kingdom
540099,21216,"SET 3 RETROSPOT TEA,COFFEE,SUGAR",4,1/4/2011 16:41,4.95,15808.0,United Kingdom
574755,22041,"RECORD FRAME 7"" SINGLE SIZE ",6,11/7/2011 9:28,2.55,13078.0,United Kingdom
555820,21792,CLASSIC FRENCH STYLE BASKET GREEN ,8,6/7/2011 12:01,3.95,16133.0,United Kingdom
536821,22631,CIRCUS PARADE LUNCH BOX ,1,12/2/2010 17:17,1.95,17757.0,United Kingdom
549155,35921,EASTER BUNNY HANGING GARLAND,1,4/6/2011 17:08,4.96,,United Kingdom
571747,23494,VINTAGE DOILY DELUXE SEWING KIT ,3,10/19/2011 10:59,5.95,13849.0,United Kingdom
570016,22267,EASTER DECORATION EGG BUNNY ,24,10/7/2011 10:06,0.39,14911.0,EIRE
551423,22302,COFFEE MUG PEARS  DESIGN,1,4/28/2011 14:31,2.55,,United Kingdom
540848,21382,SET/4 SPRING FLOWER DECORATION,1,1/12/2011 9:26,5.91,,United Kingdom
538313,16258A,SWIRLY CIRCULAR RUBBERS IN BAG,1,12/10/2010 13:50,0.42,15514.0,United Kingdom
578270,22903,CALENDAR FAMILY FAVOURITES,2,11/23/2011 13:39,2.46,14096.0,United Kingdom
570225,23366,SET 12 COLOURING PENCILS DOILY,3,10/9/2011 13:15,0.65,16595.0,United Kingdom
567697,23280,FOLDING BUTTERFLY MIRROR HOT PINK ,12,9/22/2011 8:41,0.83,16558.0,United Kingdom
549586,20725,LUNCH BAG RED RETROSPOT,31,4/11/2011 10:00,4.96,,United Kingdom
537135,84032B,CHARLIE + LOLA RED HOT WATER BOTTLE,3,12/5/2010 12:35,2.95,17059.0,United Kingdom
547960,22993,SET OF 4 PANTRY JELLY MOULDS,2,3/28/2011 15:27,1.25,15644.0,United Kingdom
580999,22182,CAKE STAND VICTORIAN FILIGREE SMALL,4,12/6/2011 17:49,1.25,17883.0,United Kingdom
572306,20735,BLACK MINI TAPE MEASURE ,2,10/23/2011 15:11,0.85,17841.0,United Kingdom
573585,21181,PLEASE ONE PERSON METAL SIGN,2,10/31/2011 14:41,4.13,,United Kingdom
552548,22061,LARGE CAKE STAND  HANGING STRAWBERY,2,5/10/2011 10:35,9.95,16357.0,United Kingdom
570232,22411,JUMBO SHOPPER VINTAGE RED PAISLEY,1,10/9/2011 13:58,2.08,14040.0,United Kingdom
576245,21931,JUMBO STORAGE BAG SUKI,10,11/14/2011 13:40,2.08,12553.0,France
579183,71477,COLOURED GLASS STAR T-LIGHT HOLDER,48,11/28/2011 15:16,3.29,15621.0,United Kingdom
540277,84356,POMPOM CURTAIN,36,1/6/2011 12:18,1.95,14258.0,United Kingdom
538153,22171,3 HOOK PHOTO SHELF ANTIQUE WHITE,1,12/9/2010 16:31,16.98,,United Kingdom
563549,22277,COSMETIC BAG VINTAGE ROSE PAISLEY,1,8/17/2011 12:34,4.13,,United Kingdom
C554851,22617,BAKING SET SPACEBOY DESIGN,-1,5/27/2011 9:17,4.95,16463.0,United Kingdom
558860,85032A,ROMANTIC IMAGES GIFT WRAP SET,1,7/4/2011 12:18,0.65,17975.0,United Kingdom
573904,84944,SET OF 6 KASHMIR FOLKART BAUBLES,1,11/1/2011 14:54,1.65,14505.0,United Kingdom
