InvoiceNo,StockCode,Description,Quantity,InvoiceDate,UnitPrice,CustomerID,Country
577768,20979,36 PENCILS TUBE RED RETROSPOT,1,11/21/2011 15:18,2.46,,United Kingdom
550986,20712,JUMBO BAG WOODLAND ANIMALS,2,4/21/2011 18:06,4.13,,United Kingdom
580672,22544,MINI JIGSAW SPACEBOY,3,12/5/2011 14:29,0.19,17920.0,United Kingdom
551566,22131,FOOD CONTAINER SET 3 LOVE HEART ,10,5/3/2011 11:11,1.95,13113.0,United Kingdom
545085,22385,JUMBO BAG SPACEBOY DESIGN,10,2/28/2011 11:19,1.95,15039.0,United Kingdom
562934,22356,CHARLOTTE BAG PINK POLKADOT,1,8/10/2011 16:56,1.63,,United Kingdom
544459,21703,BAG 125g SWIRLY MARBLES,48,2/20/2011 13:52,0.42,17838.0,United Kingdom
543197,22919,HERB MARKER MINT,12,2/4/2011 12:36,0.65,12842.0,United Kingdom
559360,23256,CHILDRENS CUTLERY SPACEBOY ,1,7/7/2011 19:54,4.15,14657.0,United Kingdom
C563948,23029,DRAWER KNOB CRACKLE GLAZE GREEN,-6,8/22/2011 10:30,1.65,13089.0,United Kingdom
580520,22113,GREY HEART HOT WATER BOTTLE,2,12/4/2011 14:55,4.25,13521.0,United Kingdom
571032,22224,WHITE LOVEBIRD LANTERN,2,10/13/2011 12:38,2.95,13827.0,United Kingdom
540247,21415,CLAM SHELL SMALL ,2,1/5/2011 15:56,2.1,15464.0,United Kingdom
544102,22242,5 HOOK HANGER MAGIC TOADSTOOL,1,2/16/2011 10:32,1.65,14665.0,United Kingdom
567482,22382,LUNCH BAG SPACEBOY DESIGN ,1,9/20/2011 13:42,1.65,16464.0,United Kingdom
563288,23007, SPACEBOY BABY GIFT SET,2,8/15/2011 12:53,16.95,12656.0,France
561367,21212,PACK OF 72 RETROSPOT CAKE CASES,11,7/26/2011 15:46,2.08,,United Kingdom
561862,21088,SET/6 FRUIT SALAD PAPER CUPS,3,7/31/2011 10:38,0.19,15569.0,United Kingdom
566634,82583,HOT BATHS METAL SIGN,72,9/14/2011 10:42,1.85,13183.0,United Kingdom
536819,22898,CHILDRENS APRON APPLES DESIGN,8,12/2/2010 17:12,1.95,13402.0,United Kingdom
537225,22965,3 TRADITIONAl BISCUIT CUTTERS  SET,2,12/5/2010 16:41,2.1,12748.0,United Kingdom
573347,21479,WHITE SKULL HOT WATER BOTTLE ,2,10/30/2011 12:26,4.25,13137.0,United Kingdom
548708,84313C,ORANGE TV TRAY TABLE ,2,4/3/2011 12:41,1.95,13269.0,United Kingdom
574741,21773,DECORATIVE ROSE BATHROOM BOTTLE,2,11/6/2011 16:13,1.25,15993.0,United Kingdom
552184,21908,CHOCOLATE THIS WAY METAL SIGN,12,5/6/2011 13:43,2.1,13741.0,United Kingdom
564837,21770,OPEN CLOSED METAL SIGN,1,8/30/2011 12:40,9.96,,United Kingdom
561808,21928,JUMBO BAG SCANDINAVIAN BLUE PAISLEY,10,7/29/2011 15:11,2.08,13534.0,United Kingdom
C560540,22545,MINI JIGSAW BUNNIES,-1,7/19/2011 12:26,0.42,12415.0,Australia
572704,21243,PINK  POLKADOT PLATE ,2,10/25/2011 14:39,3.29,,United Kingdom
567702,20704,MR ROBOT SOFT TOY,4,9/22/2011 9:38,6.95,15810.0,United Kingdom
550297,23000,TRAVEL CARD WALLET TRANSPORT,24,4/15/2011 15:58,0.42,14056.0,United Kingdom
564135,23307,SET OF 60 PANTRY DESIGN CAKE CASES ,12,8/23/2011 11:12,0.55,16550.0,United Kingdom
536754,22633,HAND WARMER UNION JACK,4,12/2/2010 14:09,2.1,14449.0,United Kingdom
581471,22220,CAKE STAND LOVEBIRD 2 TIER WHITE,4,12/8/2011 19:29,2.95,14702.0,United Kingdom
547789,21381,MINI WOODEN HAPPY BIRTHDAY GARLAND,12,3/25/2011 12:04,1.69,14911.0,EIRE
565408,47574A,ENGLISH ROSE SCENTED HANGING FLOWER,2,9/4/2011 11:12,0.75,16813.0,United Kingdom
547029,23051,RECYCLED ACAPULCO MAT BLUE,1,3/20/2011 10:17,8.25,15465.0,United Kingdom
573585,82494L,WOODEN FRAME ANTIQUE WHITE ,1,10/31/2011 14:41,7.46,,United Kingdom
578934,22110,BIRD HOUSE HOT WATER BOTTLE,2,11/27/2011 12:47,2.55,14577.0,United Kingdom
545658,21985,PACK OF 12 HEARTS DESIGN TISSUES ,12,3/4/2011 14:13,0.29,14670.0,United Kingdom
546896,21484,CHICK GREY HOT WATER BOTTLE,1,3/17/2011 18:24,7.46,,United Kingdom
565765,22530,MAGIC DRAWING SLATE DOLLY GIRL ,24,9/6/2011 14:19,0.42,12526.0,Germany
577479,82613C,"METAL SIGN,CUPCAKE SINGLE HOOK",8,11/20/2011 11:34,1.25,14911.0,EIRE
580158,23392,SPACEBOY ROCKET LOLLY MAKERS,24,12/2/2011 10:41,2.08,12558.0,USA
554617,82582,AREA PATROLLED METAL SIGN,1,5/25/2011 11:21,2.1,14593.0,United Kingdom
564838,21992,VINTAGE PAISLEY STATIONERY SET,1,8/30/2011 12:43,2.46,,United Kingdom
559923,22204,MILK PAN BLUE POLKADOT,1,7/13/2011 16:07,3.29,,United Kingdom
581217,23388,WOODLAND MINI BACKPACK,1,12/8/2011 9:20,8.29,,United Kingdom
544676,79321,CHILLI LIGHTS,2,2/22/2011 16:03,5.75,17841.0,United Kingdom
552264,84947,ANTIQUE SILVER TEA GLASS ENGRAVED,6,5/8/2011 11:38,1.25,14959.0,United Kingdom
567474,85152,HAND OVER THE CHOCOLATE   SIGN ,6,9/20/2011 12:53,2.1,13448.0,United Kingdom
567307,23203,JUMBO BAG VINTAGE DOILY ,20,9/19/2011 13:35,2.08,15078.0,United Kingdom
546999,85123A,WHITE HANGING HEART T-LIGHT HOLDER,32,3/18/2011 13:47,2.55,17133.0,United Kingdom
559134,22697,GREEN REGENCY TEACUP AND SAUCER,6,7/6/2011 13:14,2.95,12700.0,France
560915,23203,JUMBO BAG DOILEY PATTERNS,10,7/21/2011 18:19,2.08,13313.0,United Kingdom
536390,22963,JAM JAR WITH GREEN LID,48,12/1/2010 10:19,0.72,17511.0,United Kingdom
575627,35095B,RED VICTORIAN FABRIC OVAL BOX,6,11/10/2011 13:28,0.42,17977.0,United Kingdom
536857,85049B,LUSH GREENS RIBBONS,4,12/3/2010 10:33,1.25,16883.0,United Kingdom
557112,20986,BLUE CALCULATOR RULER,1,6/16/2011 16:31,2.46,,United Kingdom
538371,21479,WHITE SKULL HOT WATER BOTTLE ,3,12/12/2010 11:07,3.75,15570.0,United Kingdom
558455,23321,SMALL WHITE HEART OF WICKER,12,6/29/2011 13:58,1.65,14327.0,United Kingdom
557642,35004B,SET OF 3 BLACK FLYING DUCKS,1,6/21/2011 16:35,12.46,,United Kingdom
541497,20963,APPLE BATH SPONGE,1,1/18/2011 15:19,2.46,,United Kingdom
560209,85152,HAND OVER THE CHOCOLATE   SIGN ,1,7/15/2011 14:05,2.1,15004.0,United Kingdom
580677,22603,CHRISTMAS RETROSPOT TREE WOOD,6,12/5/2011 14:40,0.85,16200.0,United Kingdom
559817,22457,NATURAL SLATE HEART CHALKBOARD ,3,7/12/2011 16:20,5.79,,United Kingdom
573393,23435,3 RAFFIA RIBBONS VINTAGE CHRISTMAS,10,10/30/2011 15:08,0.79,14158.0,United Kingdom
547870,85071A,BLUE CHARLIE+LOLA PERSONAL DOORSIGN,3,3/27/2011 14:18,2.95,13668.0,United Kingdom
548973,22698,PINK REGENCY TEACUP AND SAUCER,6,4/5/2011 11:44,2.95,15674.0,United Kingdom
548893,22428,ENAMEL FIRE BUCKET CREAM,1,4/4/2011 15:54,14.13,,United Kingdom
565233,23201,JUMBO BAG ALPHABET,1,9/2/2011 9:34,4.13,,United Kingdom
580720,23497,CLASSIC CHROME BICYCLE BELL ,1,12/5/2011 16:55,1.45,14629.0,United Kingdom
578292,22867,HAND WARMER BIRD DESIGN,1,11/23/2011 14:35,2.1,13174.0,United Kingdom
542895,22079,RIBBON REEL HEARTS DESIGN ,5,2/1/2011 13:47,1.65,14549.0,United Kingdom
566446,21086,SET/6 RED SPOTTY PAPER CUPS,3,9/12/2011 15:40,1.63,,United Kingdom
556970,23239,SET OF 4 KNICK KNACK TINS POPPIES,6,6/16/2011 10:18,4.15,13082.0,United Kingdom
568200,21524,DOORMAT SPOTTY HOME SWEET HOME,2,9/25/2011 14:58,8.25,16198.0,United Kingdom
579124,79191C,RETRO PLASTIC ELEPHANT TRAY,2,11/28/2011 12:14,0.85,15721.0,United Kingdom
577469,23144,ZINC T-LIGHT HOLDER STARS SMALL,2,11/20/2011 11:25,0.83,15009.0,United Kingdom
559055,21211,SET OF 72 SKULL PAPER  DOILIES,3,7/5/2011 17:09,1.25,,United Kingdom
575631,23530,WALL ART ONLY ONE PERSON ,1,11/10/2011 13:41,4.95,15184.0,United Kingdom
542526,85188B,PINK METAL SWINGING BUNNY,10,1/28/2011 12:43,0.85,14659.0,United Kingdom
565438,21929,JUMBO BAG PINK VINTAGE PAISLEY,10,9/4/2011 13:56,2.08,17229.0,United Kingdom
564722,22804,CANDLEHOLDER PINK HANGING HEART,2,8/28/2011 12:06,2.95,16456.0,United Kingdom
544077,21717,EASTER TIN BUCKET,6,2/15/2011 15:04,2.55,14825.0,United Kingdom
