InvoiceNo,StockCode,Description,Quantity,InvoiceDate,UnitPrice,CustomerID,Country
569372,23416,CHAMBRE HOOK,1,10/3/2011 16:04,3.29,,United Kingdom
555645,20727,LUNCH BAG  BLACK SKULL.,5,6/6/2011 13:31,1.65,18016.0,United Kingdom
575507,22636,CHILDS BREAKFAST SET CIRCUS PARADE,8,11/10/2011 10:32,7.65,17197.0,United Kingdom
580640,23333,IVORY WICKER HEART MEDIUM,3,12/5/2011 12:51,1.25,16910.0,United Kingdom
542929,22667,RECIPE BOX RETROSPOT ,1,2/2/2011 10:34,2.95,17811.0,United Kingdom
557034,23263,SET OF 3 WOODEN HEART DECORATIONS,12,6/16/2011 13:50,1.25,13627.0,United Kingdom
573274,21670,BLUE SPOT CERAMIC DRAWER KNOB,2,10/28/2011 13:10,3.29,,United Kingdom
577126,22348,TEA BAG PLATE RED RETROSPOT,24,11/17/2011 19:22,0.85,12406.0,Denmark
560504,22417,PACK OF 60 SPACEBOY CAKE CASES,24,7/19/2011 11:47,0.55,13081.0,United Kingdom
568212,23493,VINTAGE DOILY TRAVEL SEWING KIT,1,9/25/2011 16:05,1.95,15154.0,United Kingdom
541999,84598,BOYS ALPHABET IRON ON PATCHES,4,1/25/2011 10:45,0.42,,United Kingdom
565917,21314,SMALL GLASS HEART TRINKET POT,2,9/7/2011 16:15,4.13,,United Kingdom
562984,21035,SET/2 RED RETROSPOT TEA TOWELS ,1,8/11/2011 11:45,3.25,17841.0,United Kingdom
579471,22378,WALL TIDY RETROSPOT ,1,11/29/2011 15:08,4.96,,United Kingdom
547651,85205B,PINK FELT EASTER RABBIT GARLAND,2,3/24/2011 12:11,2.55,16904.0,United Kingdom
567721,20914,SET/5 RED RETROSPOT LID GLASS BOWLS,32,9/22/2011 10:38,2.55,12409.0,Switzerland
559923,21580,RABBIT  DESIGN  COTTON TOTE BAG,2,7/13/2011 16:07,1.63,,United Kingdom
575138,23328,SET 6 SCHOOL MILK BOTTLES IN CRATE,2,11/8/2011 15:24,7.46,,United Kingdom
548007,84836,ZINC METAL HEART DECORATION,12,3/29/2011 10:51,1.25,13769.0,United Kingdom
575931,22910,PAPER CHAIN KIT VINTAGE CHRISTMAS,6,11/13/2011 10:35,2.95,16560.0,United Kingdom
566917,22834,HAND WARMER BABUSHKA DESIGN,12,9/15/2011 14:37,2.1,18259.0,United Kingdom
556082,21328,BALLOONS  WRITING SET ,1,6/8/2011 15:22,3.29,,United Kingdom
581481,22059,CERAMIC STRAWBERRY DESIGN MUG,24,12/9/2011 9:07,0.39,17490.0,United Kingdom
570674,22049,WRAP CHRISTMAS SCREEN PRINT,25,10/11/2011 14:59,0.19,14911.0,EIRE
537626,84997B,RED 3 PIECE RETROSPOT CUTLERY SET,6,12/7/2010 14:57,3.75,12347.0,Iceland
546121,22023,EMPIRE BIRTHDAY CARD,12,3/9/2011 14:30,0.42,14085.0,United Kingdom
580610,85099C,JUMBO  BAG BAROQUE BLACK WHITE,3,12/5/2011 11:48,4.13,,United Kingdom
560688,21932,SCANDINAVIAN PAISLEY PICNIC BAG,5,7/20/2011 11:54,1.65,16393.0,United Kingdom
552234,21380,WOODEN HAPPY BIRTHDAY GARLAND,1,5/6/2011 16:01,5.79,,United Kingdom
546896,21121,SET/10 RED POLKADOT PARTY CANDLES,2,3/17/2011 18:24,2.46,,United Kingdom
581167,22386,JUMBO BAG PINK POLKADOT,20,12/7/2011 14:52,2.08,13534.0,United Kingdom
561535,21533,RETROSPOT LARGE MILK JUG,12,7/28/2011 9:48,4.25,15116.0,United Kingdom
545462,22673,FRENCH GARDEN SIGN BLUE METAL,12,3/3/2011 8:24,1.25,17567.0,United Kingdom
551173,35004B,SET OF 3 BLACK FLYING DUCKS,1,4/26/2011 16:54,5.79,,United Kingdom
550317,22919,HERB MARKER MINT,12,4/17/2011 11:56,0.65,15172.0,United Kingdom
580115,22900,SET 2 TEA TOWELS I LOVE LONDON ,1,12/1/2011 16:22,6.63,,United Kingdom
544186,22391,PAPERWEIGHT HOME SWEET HOME,1,2/16/2011 15:56,4.96,,United Kingdom
559337,22717,CARD DOG AND BALL ,1,7/7/2011 16:27,0.83,,United Kingdom
562034,22727,ALARM CLOCK BAKELIKE RED ,8,8/2/2011 9:14,3.75,12449.0,Belgium
543179,22543,MINI JIGSAW BAKE A CAKE ,1,2/4/2011 10:32,0.42,12754.0,Japan
555949,21326,AGED GLASS SILVER T-LIGHT HOLDER,12,6/8/2011 10:50,0.65,16626.0,United Kingdom
541104,20685,DOORMAT RED RETROSPOT,1,1/13/2011 14:29,14.13,,United Kingdom
548327,22385,JUMBO BAG SPACEBOY DESIGN,1,3/30/2011 13:05,2.08,16788.0,United Kingdom
539958,90200A,PURPLE SWEETHEART BRACELET,1,12/23/2010 13:26,4.24,,United Kingdom
575930,22123,PING MICROWAVE APRON,2,11/11/2011 17:58,4.13,,United Kingdom
576463,22328,ROUND SNACK BOXES SET OF 4 FRUITS ,2,11/15/2011 11:37,2.95,17974.0,United Kingdom
551315,21272,SALLE DE BAIN HOOK,12,4/27/2011 15:08,1.25,17725.0,United Kingdom
567290,23295,SET OF 12 MINI LOAF BAKING CASES,128,9/19/2011 11:54,0.72,14646.0,Netherlands
540907,22423,REGENCY CAKESTAND 3 TIER,6,1/12/2011 11:52,12.75,13488.0,United Kingdom
543162,22961,JAM MAKING SET PRINTED,6,2/3/2011 18:08,1.45,17507.0,United Kingdom
546769,22227,HANGING HEART MIRROR DECORATION ,24,3/16/2011 14:57,0.65,17504.0,United Kingdom
538903,84970L,SINGLE HEART ZINC T-LIGHT HOLDER,12,12/15/2010 10:17,0.95,13496.0,United Kingdom
566757,21876,POTTERING MUG,1,9/14/2011 15:54,3.29,,United Kingdom
572086,23489,"GARLAND, VINTAGE BELLS",6,10/20/2011 14:30,2.89,13897.0,United Kingdom
541524,22442,GROW YOUR OWN FLOWERS SET OF 3,2,1/19/2011 10:49,7.95,17091.0,United Kingdom
581404,22695,WICKER WREATH SMALL,3,12/8/2011 13:47,0.59,13680.0,United Kingdom
573381,23076,ICE CREAM SUNDAE LIP GLOSS,24,10/30/2011 14:05,1.25,17590.0,United Kingdom
570192,22940,FELTCRAFT CHRISTMAS FAIRY,4,10/7/2011 15:26,4.25,17509.0,United Kingdom
575728,21224,SET/4 SKULL BADGES,10,11/10/2011 19:40,1.25,14911.0,EIRE
573125,23170,REGENCY TEA PLATE ROSES ,12,10/27/2011 16:31,1.65,16855.0,United Kingdom
570223,22611,VINTAGE UNION JACK SHOPPING BAG,3,10/9/2011 13:11,4.95,15787.0,United Kingdom
536806,82581,TOILET METAL SIGN,12,12/2/2010 16:42,0.55,12971.0,United Kingdom
547800,21790,VINTAGE SNAP CARDS,2,3/25/2011 12:55,0.85,14504.0,United Kingdom
539708,22318,FIVE HEART HANGING DECORATION,1,12/21/2010 12:18,5.91,,United Kingdom
554630,22992,REVOLVER WOODEN RULER ,1,5/25/2011 11:34,1.95,13268.0,United Kingdom
564433,11001,ASSTD DESIGN RACING CAR PEN,16,8/25/2011 11:46,1.69,16503.0,United Kingdom
563366,23069,EDWARDIAN PHOTO FRAME,2,8/16/2011 8:52,6.25,15373.0,United Kingdom
553657,22868,NUMBER TILE COTTAGE GARDEN 0 ,1,5/18/2011 11:28,1.95,14583.0,United Kingdom
541219,90013C,GREEN VINTAGE EARRINGS ,1,1/14/2011 14:06,4.15,,United Kingdom
560997,85136C,RED SHARK HELICOPTER,2,7/22/2011 13:59,7.95,12627.0,Germany
553946,22763,KEY CABINET MA CAMPAGNE,2,5/20/2011 10:48,9.95,15601.0,United Kingdom
547861,22399,MAGNETS PACK OF 4 CHILDHOOD MEMORY,12,3/27/2011 12:36,1.25,16701.0,United Kingdom
559107,85183B,CHARLIE & LOLA WASTEPAPER BIN FLORA,2,7/6/2011 11:22,1.25,15334.0,United Kingdom
564817,22356,CHARLOTTE BAG PINK POLKADOT,1,8/30/2011 12:02,1.63,,United Kingdom
569633,21688,SILVER PLATE CANDLE BOWL SMALL,6,10/5/2011 12:02,2.95,16478.0,United Kingdom
551305,16156S,WRAP PINK FAIRY CAKES ,25,4/27/2011 14:58,0.42,16145.0,United Kingdom
562024,22557,PLASTERS IN TIN VINTAGE PAISLEY ,1,8/1/2011 16:07,3.29,,United Kingdom
576686,20718,RED RETROSPOT SHOPPER BAG,2,11/16/2011 12:08,1.25,16916.0,United Kingdom
565934,22605,WOODEN CROQUET GARDEN SET,4,9/8/2011 10:45,12.75,18222.0,United Kingdom
557955,23061,VINTAGE EMBOSSED HEART,12,6/23/2011 18:59,1.25,16175.0,United Kingdom
580877,21621,VINTAGE UNION JACK BUNTING,4,12/6/2011 12:15,8.5,17250.0,United Kingdom
560979,21980,PACK OF 12 RED RETROSPOT TISSUES ,24,7/22/2011 12:21,0.29,15232.0,United Kingdom
537135,21803,CHRISTMAS TREE STAR DECORATION,1,12/5/2010 12:35,0.42,17059.0,United Kingdom
554859,22419,LIPSTICK PEN RED,100,5/27/2011 10:16,0.36,14828.0,United Kingdom
579162,22371,AIRLINE BAG VINTAGE TOKYO 78,10,11/28/2011 13:58,4.25,16393.0,United Kingdom
575512,21219,SET/4 BADGES BALLOON GIRL,10,11/10/2011 10:36,1.25,14121.0,United Kingdom
552444,23068,ALUMINIUM STAMPED HEART,4,5/9/2011 13:10,2.49,17634.0,United Kingdom
579991,20676,RED RETROSPOT BOWL,8,12/1/2011 11:20,1.25,13159.0,United Kingdom
579456,22098,BOUDOIR SQUARE TISSUE BOX,1,11/29/2011 14:20,0.39,13428.0,United Kingdom
551558,22794,SWEETHEART WIRE MAGAZINE RACK,1,5/3/2011 10:41,7.95,17841.0,United Kingdom
551058,21172,PARTY METAL SIGN ,1,4/26/2011 12:07,1.45,14606.0,United Kingdom
556484,22989,SET 2 PANTRY DESIGN TEA TOWELS,3,6/12/2011 13:17,3.25,16938.0,United Kingdom
575640,82482,WOODEN PICTURE FRAME WHITE FINISH,6,11/10/2011 14:01,2.95,13148.0,United Kingdom
539259,22722,SET OF 6 SPICE TINS PANTRY DESIGN,4,12/16/2010 14:32,3.95,13050.0,United Kingdom
577748,23502,PLAYING CARDS VINTAGE DOILY ,12,11/21/2011 14:24,1.25,15159.0,United Kingdom
538801,84826,ASSTD DESIGN 3D PAPER STICKERS,60,12/14/2010 11:51,0.21,16083.0,United Kingdom
544207,22352,LUNCH BOX WITH CUTLERY RETROSPOT ,2,2/17/2011 10:34,4.96,,United Kingdom
565863,23433,HANGING QUILTED PATCHWORK APPLES,12,9/7/2011 15:00,0.83,17422.0,United Kingdom
555744,85159A,"BLACK TEA,COFFEE,SUGAR JARS",24,6/7/2011 10:44,1.95,18072.0,United Kingdom
562379,84976,RECTANGULAR SHAPED MIRROR,12,8/4/2011 15:17,0.79,15134.0,United Kingdom
569332,23203,JUMBO BAG VINTAGE DOILY ,2,10/3/2011 13:46,2.08,12637.0,France
558888,23207,LUNCH BAG ALPHABET DESIGN,6,7/4/2011 15:29,1.65,14056.0,United Kingdom
573999,22666,RECIPE BOX PANTRY YELLOW DESIGN,12,11/2/2011 11:43,2.95,12779.0,Poland
568901,15056P,EDWARDIAN PARASOL PINK,2,9/29/2011 13:22,5.95,15050.0,United Kingdom
573582,22139,RETROSPOT TEA SET CERAMIC 11 PC ,3,10/31/2011 14:23,4.95,16633.0,United Kingdom
551014,22937,BAKING MOULD CHOCOLATE CUPCAKES,6,4/26/2011 11:04,2.55,13209.0,United Kingdom
543836,84988,SET OF 72 PINK HEART PAPER DOILIES,12,2/14/2011 10:52,1.45,15236.0,United Kingdom
566771,23221,REINDEER HEART DECORATION SILVER,12,9/15/2011 9:34,0.83,15322.0,United Kingdom
537434,22674,FRENCH TOILET SIGN BLUE METAL,1,12/6/2010 16:57,2.51,,United Kingdom
566726,23268,SET OF 2 CERAMIC CHRISTMAS REINDEER,3,9/14/2011 13:12,1.45,15021.0,United Kingdom
572897,22670,FRENCH WC SIGN BLUE METAL,1,10/26/2011 14:42,2.46,,United Kingdom
557892,23053,RECYCLED ACAPULCO MAT PINK,3,6/23/2011 14:11,8.25,14534.0,United Kingdom
564719,22097,SWALLOW SQUARE TISSUE BOX,3,8/28/2011 11:55,0.39,15325.0,United Kingdom
C564748,22978,PANTRY ROLLING PIN,-5,8/30/2011 8:00,3.75,14911.0,EIRE
554644,47580,TEA TIME DES TEA COSY,2,5/25/2011 12:34,2.55,15311.0,United Kingdom
575875,22659,LUNCH BOX I LOVE LONDON,1,11/11/2011 13:06,4.13,,United Kingdom
543179,22532,MAGIC DRAWING SLATE LEAP FROG ,1,2/4/2011 10:32,0.42,12754.0,Japan
579175,23301,GARDENERS KNEELING PAD KEEP CALM ,2,11/28/2011 14:39,1.65,14562.0,United Kingdom
580286,23252,VINTAGE RED ENAMEL TRIM JUG ,4,12/2/2011 13:28,3.75,17611.0,United Kingdom
568158,20749,ASSORTED COLOUR MINI CASES,12,9/25/2011 12:22,6.35,16133.0,United Kingdom
572552,21258,VICTORIAN SEWING BOX LARGE,1,10/24/2011 17:07,24.96,14096.0,United Kingdom
537126,20677,PINK POLKADOT BOWL,1,12/5/2010 12:13,1.25,18118.0,United Kingdom
565930,23264,SET OF 3 WOODEN SLEIGH DECORATIONS,12,9/8/2011 10:32,1.25,12685.0,France
574292,23438, RED SPOT GIFT BAG LARGE,40,11/3/2011 15:27,1.25,16914.0,United Kingdom
581118,21466,RED FLOWER CROCHET FOOD COVER,6,12/7/2011 12:26,3.75,15136.0,United Kingdom
549321,22969,HOMEMADE JAM SCENTED CANDLES,12,4/8/2011 10:19,1.45,14243.0,United Kingdom
572553,22579,WOODEN TREE CHRISTMAS SCANDINAVIAN,1,10/24/2011 17:09,0.83,,United Kingdom
554202,22429,ENAMEL MEASURING JUG CREAM,2,5/23/2011 12:14,4.25,13546.0,United Kingdom
567804,23365,SET 12 COLOUR PENCILS LOVE LONDON,3,9/22/2011 12:13,0.65,17920.0,United Kingdom
575323,20970,PINK FLORAL FELTCRAFT SHOULDER BAG,4,11/9/2011 13:37,3.75,15392.0,United Kingdom
580660,23301,GARDENERS KNEELING PAD KEEP CALM ,12,12/5/2011 13:49,1.65,16592.0,United Kingdom
579434,23497,CLASSIC CHROME BICYCLE BELL ,12,11/29/2011 13:17,1.45,16678.0,United Kingdom
573580,23284,DOORMAT KEEP CALM AND COME IN,2,10/31/2011 14:21,15.79,,United Kingdom
546998,22358,KINGS CHOICE TEA CADDY ,3,3/18/2011 13:32,2.95,16023.0,United Kingdom
547830,21111,"SWISS ROLL TOWEL, CHOCOLATE  SPOTS",1,3/25/2011 15:50,5.79,,United Kingdom
566221,21110,LARGE CAKE TOWEL PINK SPOTS,5,9/9/2011 16:13,1.95,,United Kingdom
542369,22492,MINI PAINT SET VINTAGE ,36,1/27/2011 13:08,0.65,12645.0,Germany
563022,23199,JUMBO BAG APPLES,1,8/11/2011 13:34,2.08,17248.0,United Kingdom
547578,21754,HOME BUILDING BLOCK WORD,4,3/24/2011 10:38,5.95,13089.0,United Kingdom
556813,22366,DOORMAT AIRMAIL ,1,6/14/2011 17:28,15.79,,United Kingdom
581217,72799E,IVORY PILLAR CANDLE SILVER FLOCK,3,12/8/2011 9:20,3.29,,United Kingdom
557886,84992,72 SWEETHEART FAIRY CAKE CASES,4,6/23/2011 13:39,0.55,17799.0,United Kingdom
581217,22110,BIRD HOUSE HOT WATER BOTTLE,4,12/8/2011 9:20,5.79,,United Kingdom
566018,22211,WOOD STAMP SET FLOWERS,1,9/8/2011 12:42,0.83,13137.0,United Kingdom
554310,22969,HOMEMADE JAM SCENTED CANDLES,2,5/23/2011 15:25,3.29,,United Kingdom
576058,22175,PINK OWL SOFT TOY,18,11/13/2011 15:15,2.95,15654.0,United Kingdom
579407,21790,VINTAGE SNAP CARDS,12,11/29/2011 12:32,0.85,13657.0,United Kingdom
577536,21812,GARLAND WITH HEARTS AND BELLS,1,11/20/2011 14:14,4.95,15850.0,United Kingdom
571544,23320,GIANT 50'S CHRISTMAS CRACKER,1,10/17/2011 16:53,2.89,17757.0,United Kingdom
573366,21189,WHITE HONEYCOMB PAPER GARLAND ,6,10/30/2011 13:17,1.65,16361.0,United Kingdom
569137,22074,6 RIBBONS SHIMMERING PINKS ,2,9/30/2011 14:45,2.46,,United Kingdom
577949,21804,check,44,11/22/2011 12:09,0.0,,United Kingdom
547811,22442,GROW YOUR OWN FLOWERS SET OF 3,2,3/25/2011 14:01,7.95,17368.0,United Kingdom
580610,22173,METAL 4 HOOK HANGER FRENCH CHATEAU,2,12/5/2011 11:48,5.79,,United Kingdom
563031,23152,IVORY SWEETHEART WIRE LETTER RACK ,1,8/11/2011 14:38,3.75,13263.0,United Kingdom
543829,21238,RED RETROSPOT CUP,96,2/14/2011 9:47,0.72,12939.0,United Kingdom
571716,21930,JUMBO STORAGE BAG SKULLS,2,10/18/2011 17:05,4.13,,United Kingdom
576329,23480,MINI LIGHTS WOODLAND MUSHROOMS,2,11/14/2011 15:22,7.46,,United Kingdom
572185,23206,LUNCH BAG APPLE DESIGN,9,10/21/2011 10:52,4.96,,United Kingdom
565617,84836,ZINC METAL HEART DECORATION,1,9/5/2011 15:30,2.46,,United Kingdom
553549,21936,RED RETROSPOT PICNIC BAG,1,5/17/2011 16:09,5.79,,United Kingdom
557026,22211,WOOD STAMP SET FLOWERS,12,6/16/2011 13:14,0.83,16571.0,United Kingdom
567288,23339,EGG FRYING PAN BLUE ,1,9/19/2011 11:49,2.08,16906.0,United Kingdom
C543790,21232,STRAWBERRY CERAMIC TRINKET BOX,-5,2/11/2011 17:12,1.25,17071.0,United Kingdom
540372,22896,PEG BAG APPLES DESIGN,6,1/6/2011 16:41,2.55,13081.0,United Kingdom
549958,22211,WOOD STAMP SET FLOWERS,2,4/13/2011 13:47,1.65,17589.0,United Kingdom
539492,84884A,ANT WHITE WIRE HEART SPIRAL,1,12/20/2010 10:14,8.47,,United Kingdom
557525,22954,HEN PARTY CORDON BARRIER TAPE,12,6/21/2011 9:26,1.25,12759.0,Netherlands
555510,22088,PAPER BUNTING COLOURED LACE,3,6/3/2011 17:09,5.79,,United Kingdom
575475,23348,CHILDRENS TOY COOKING UTENSIL SET,6,11/9/2011 16:03,2.08,17702.0,United Kingdom
549278,22766,PHOTO FRAME CORNICE,4,4/7/2011 13:16,2.95,16255.0,United Kingdom
549155,22587,FELTCRAFT HAIRBAND RED AND BLUE,1,4/6/2011 17:08,1.63,,United Kingdom
552659,20675,BLUE POLKADOT BOWL,2,5/10/2011 15:03,2.46,,United Kingdom
572558,10125,MINI FUNKY DESIGN TAPES,20,10/25/2011 8:26,0.85,14286.0,United Kingdom
541489,22195,LARGE HEART MEASURING SPOONS,4,1/18/2011 13:38,1.65,15023.0,United Kingdom
578804,21636,MADRAS NOTEBOOK MEDIUM,12,11/25/2011 12:57,0.75,17557.0,United Kingdom
556032,22669,RED BABY BUNTING ,5,6/8/2011 12:35,2.95,15159.0,United Kingdom
573492,82011C,BATHROOM SCALES FOOTPRINTS IN SAND,1,10/31/2011 11:57,3.75,13544.0,United Kingdom
577078,22616,PACK OF 12 LONDON TISSUES ,3,11/17/2011 15:17,0.83,,United Kingdom
572652,22151,PLACE SETTING WHITE HEART,24,10/25/2011 12:11,0.42,15805.0,United Kingdom
549981,22516,CHILDS GARDEN RAKE BLUE,1,4/13/2011 15:49,2.1,16348.0,United Kingdom
537346,22585,PACK OF 6 BIRDY GIFT TAGS,24,12/6/2010 12:21,1.25,15301.0,United Kingdom
547081,22993,SET OF 4 PANTRY JELLY MOULDS,12,3/20/2011 15:07,1.25,14205.0,United Kingdom
547946,21448,12 DAISY PEGS IN WOOD BOX,12,3/28/2011 14:59,1.65,12971.0,United Kingdom
537434,21367,MIRRORED WALL ART GENTS,1,12/6/2010 16:57,5.06,,United Kingdom
547552,22196,SMALL HEART MEASURING SPOONS,1,3/23/2011 15:55,1.63,,United Kingdom
551009,22386,JUMBO BAG PINK POLKADOT,11,4/26/2011 9:50,4.13,,United Kingdom
552676,20676,RED RETROSPOT BOWL,1,5/10/2011 15:07,2.46,,United Kingdom
572037,22569,FELTCRAFT CUSHION BUTTERFLY,6,10/20/2011 12:07,3.75,17365.0,United Kingdom
553545,20712,JUMBO BAG WOODLAND ANIMALS,8,5/17/2011 15:37,4.13,,United Kingdom
570222,84988,SET OF 72 PINK HEART PAPER DOILIES,10,10/9/2011 12:59,1.45,13113.0,United Kingdom
569520,21155,RED RETROSPOT PEG BAG,6,10/4/2011 14:32,2.55,17667.0,United Kingdom
576329,22375,AIRLINE BAG VINTAGE JET SET BROWN,2,11/14/2011 15:22,8.29,,United Kingdom
577095,85035C,ROSE 3 WICK MORRIS BOX CANDLE,2,11/17/2011 16:39,1.25,15867.0,United Kingdom
558241,23187,FRENCH STYLE STORAGE JAR BONBONS,48,6/27/2011 15:28,0.29,15932.0,United Kingdom
544924,22271,FELTCRAFT DOLL ROSIE,6,2/24/2011 17:18,2.95,13851.0,United Kingdom
567656,22738,RIBBON REEL SNOWY VILLAGE,4,9/21/2011 14:40,3.29,14096.0,United Kingdom
569898,22139,RETROSPOT TEA SET CERAMIC 11 PC ,2,10/6/2011 16:08,10.79,,United Kingdom
578690,22156,HEART DECORATION WITH PEARLS ,1,11/25/2011 9:36,0.85,17302.0,United Kingdom
543989,21191,LARGE WHITE HONEYCOMB PAPER BELL  ,48,2/15/2011 9:52,1.69,12415.0,Australia
574476,22505,MEMO BOARD COTTAGE DESIGN,1,11/4/2011 12:20,4.95,17203.0,United Kingdom
569528,23367,SET 12 COLOUR PENCILS SPACEBOY ,12,10/4/2011 14:53,0.65,16242.0,United Kingdom
549587,22832,BROCANTE SHELF WITH HOOKS,2,4/11/2011 10:01,10.75,15737.0,United Kingdom
559011,22089,PAPER BUNTING VINTAGE PAISLEY,6,7/5/2011 12:50,2.95,17049.0,United Kingdom
570096,84347,ROTATING SILVER ANGELS T-LIGHT HLDR,1,10/7/2011 11:58,2.55,15311.0,United Kingdom
553768,84380,SET OF 3 BUTTERFLY COOKIE CUTTERS,1,5/19/2011 10:47,3.29,,United Kingdom
541990,22259,FELT FARM ANIMAL HEN,12,1/25/2011 9:01,1.25,13901.0,United Kingdom
558235,48187,DOORMAT NEW ENGLAND,2,6/27/2011 14:41,7.95,16242.0,United Kingdom
541133,22156,HEART DECORATION WITH PEARLS ,1,1/14/2011 10:17,1.63,,United Kingdom
551014,22631,CIRCUS PARADE LUNCH BOX ,12,4/26/2011 11:04,1.95,13209.0,United Kingdom
576345,21788,KIDS RAIN MAC BLUE,24,11/14/2011 15:37,0.85,12374.0,Austria
559133,20829,GLITTER HANGING BUTTERFLY STRING,3,7/6/2011 13:13,2.1,17861.0,United Kingdom
555349,22384,LUNCH BAG PINK POLKADOT,5,6/2/2011 12:08,1.65,16729.0,United Kingdom
545998,22962,JAM JAR WITH PINK LID,12,3/8/2011 14:35,0.85,13373.0,United Kingdom
538507,22158,3 HEARTS HANGING DECORATION RUSTIC,16,12/12/2010 13:26,2.95,15547.0,United Kingdom
575491,21866,UNION JACK FLAG LUGGAGE TAG,3,11/9/2011 17:47,1.25,15531.0,United Kingdom
550532,84510A,SET OF 4 ENGLISH ROSE COASTERS,1,4/19/2011 11:02,1.25,14606.0,United Kingdom
561324,22396,MAGNETS PACK OF 4 RETRO PHOTO,12,7/26/2011 13:45,0.39,14414.0,United Kingdom
578041,22766,PHOTO FRAME CORNICE,4,11/22/2011 14:23,2.95,17338.0,United Kingdom
545058,22726,ALARM CLOCK BAKELIKE GREEN,8,2/27/2011 13:03,3.75,13767.0,United Kingdom
554976,84879,ASSORTED COLOUR BIRD ORNAMENT,32,5/29/2011 10:57,1.69,15046.0,United Kingdom
550512,72351B,SET/6 PINK  BUTTERFLY T-LIGHTS,1,4/18/2011 16:31,2.1,18069.0,United Kingdom
541110,90010B,BLACK/WHITE GLASS/SILVER BRACELET,4,1/13/2011 15:11,8.95,15916.0,United Kingdom
543193,85066,CREAM SWEETHEART MINI CHEST,2,2/4/2011 12:18,12.75,13725.0,United Kingdom
549012,23004,TRAVEL CARD WALLET PANTRY,48,4/5/2011 14:51,0.42,16394.0,United Kingdom
569898,21128,GOLD FISHING GNOME,1,10/6/2011 16:08,12.46,,United Kingdom
566952,23350,ROLL WRAP VINTAGE SPOT ,1,9/15/2011 16:37,2.46,,United Kingdom
566018,23281,FOLDING BUTTERFLY MIRROR RED  ,2,9/8/2011 12:42,0.83,13137.0,United Kingdom
562264,22355,CHARLOTTE BAG SUKI DESIGN,1,8/3/2011 16:14,1.63,,United Kingdom
564187,23199,JUMBO BAG APPLES,2,8/23/2011 15:24,2.08,15005.0,United Kingdom
544323,22565,FELTCRAFT HAIRBANDS PINK AND WHITE ,1,2/17/2011 15:51,1.63,,United Kingdom
542360,22189,CREAM HEART CARD HOLDER,1,1/27/2011 12:40,3.95,14701.0,United Kingdom
554814,85123A,WHITE HANGING HEART T-LIGHT HOLDER,12,5/26/2011 13:34,2.95,16609.0,United Kingdom
574074,22155,STAR DECORATION RUSTIC,3,11/2/2011 15:33,0.83,,United Kingdom
576236,20727,LUNCH BAG  BLACK SKULL.,2,11/14/2011 13:31,1.65,13755.0,United Kingdom
540316,21240,BLUE POLKADOT CUP,8,1/6/2011 13:00,0.85,16676.0,United Kingdom
555553,22556,PLASTERS IN TIN CIRCUS PARADE ,12,6/5/2011 13:45,1.65,12662.0,Germany
536544,90120C,GREEN MURANO TWIST BRACELET,1,12/1/2010 14:32,4.24,,United Kingdom
564657,23547,WRAP FLOWER SHOP  ,25,8/26/2011 14:44,0.42,14135.0,United Kingdom
575117,23005,TRAVEL CARD WALLET I LOVE LONDON,1,11/8/2011 14:22,0.42,12748.0,United Kingdom
538968,21495,SKULLS AND CROSSBONES WRAP,25,12/15/2010 11:34,0.42,15384.0,United Kingdom
544811,23231,WRAP DOILEY DESIGN,25,2/23/2011 15:53,0.42,12471.0,Germany
559337,22553,PLASTERS IN TIN SKULLS,1,7/7/2011 16:27,3.29,,United Kingdom
561369,22610,PENS ASSORTED FUNNY FACE,1,7/26/2011 16:22,1.63,,United Kingdom
557055,22631,CIRCUS PARADE LUNCH BOX ,12,6/16/2011 14:45,1.95,12621.0,Germany
566602,21906,PHARMACIE FIRST AID TIN,1,9/13/2011 16:05,13.29,,United Kingdom
543713,22417,PACK OF 60 SPACEBOY CAKE CASES,1,2/11/2011 11:46,2.08,,United Kingdom
568657,23306,SET OF 36 DOILIES PANTRY DESIGN,1,9/28/2011 12:22,1.45,16460.0,United Kingdom
573007,22890,NOVELTY BISCUITS CAKE STAND 3 TIER,2,10/27/2011 12:22,9.95,16009.0,United Kingdom
556184,23298,SPOTTY BUNTING,6,6/9/2011 11:39,4.95,16592.0,United Kingdom
541423,84931A,PINK SCOTTIE DOG W FLOWER PATTERN,2,1/17/2011 17:54,1.63,,United Kingdom
560773,44234,ASSORTED CIRCULAR MOBILE,1,7/20/2011 16:17,0.63,,United Kingdom
578314,22697,GREEN REGENCY TEACUP AND SAUCER,24,11/23/2011 16:33,2.55,13350.0,United Kingdom
567156,21181,PLEASE ONE PERSON METAL SIGN,4,9/16/2011 17:05,2.1,14462.0,United Kingdom
569246,85049A,TRADITIONAL CHRISTMAS RIBBONS,8,10/3/2011 9:57,2.46,14096.0,United Kingdom
565784,22697,GREEN REGENCY TEACUP AND SAUCER,6,9/6/2011 16:02,2.95,15089.0,United Kingdom
551160,22524,CHILDRENS GARDEN GLOVES BLUE,10,4/26/2011 15:04,1.25,15237.0,United Kingdom
578856,22745,POPPY'S PLAYHOUSE BEDROOM ,12,11/27/2011 11:18,2.1,17769.0,United Kingdom
538528,22467,GUMBALL COAT RACK,12,12/13/2010 9:57,2.55,15689.0,United Kingdom
560926,22741,FUNKY DIVA PEN,1,7/22/2011 9:20,1.63,,United Kingdom
538206,90200B,BLACK SWEETHEART BRACELET,2,12/10/2010 11:31,4.25,17827.0,United Kingdom
560244,85071C,"CHARLIE+LOLA""EXTREMELY BUSY"" SIGN",3,7/17/2011 12:14,0.39,16931.0,United Kingdom
562258,21467,CHERRY CROCHET FOOD COVER,1,8/3/2011 15:28,3.75,16348.0,United Kingdom
572933,22024,RAINY LADIES BIRTHDAY CARD,12,10/27/2011 10:15,0.42,13458.0,United Kingdom
544940,22960,JAM MAKING SET WITH JARS,6,2/25/2011 10:19,4.25,16592.0,United Kingdom
573601,85049a,TRADITIONAL CHRISTMAS RIBBONS,1,10/31/2011 15:24,3.29,,United Kingdom
561203,47563A,RETRO LONGBOARD IRONING BOARD COVER,12,7/25/2011 15:17,1.25,14232.0,United Kingdom
552554,22427,ENAMEL FLOWER JUG CREAM,1,5/10/2011 11:04,5.95,12843.0,United Kingdom
570418,23394,POSTE FRANCE CUSHION COVER,4,10/10/2011 13:31,3.75,15211.0,United Kingdom
575930,21808,"CHRISTMAS GARLAND STARS,TREES",5,11/11/2011 17:58,3.29,,United Kingdom
579168,22609,PENS ASSORTED SPACEBALL,72,11/28/2011 14:12,0.19,17806.0,United Kingdom
578783,82616B,FRAPPUCINO SCARF KNITTING KIT,4,11/25/2011 11:58,1.25,12748.0,United Kingdom
543040,22558,CLOTHES PEGS RETROSPOT PACK 24 ,1,2/2/2011 17:06,1.49,17337.0,United Kingdom
580612,84375,SET OF 20 KIDS COOKIE CUTTERS,3,12/5/2011 11:58,4.13,,United Kingdom
572309,85049E,SCANDINAVIAN REDS RIBBONS,1,10/23/2011 15:29,1.25,14432.0,United Kingdom
553893,22854,CREAM SWEETHEART EGG HOLDER,4,5/19/2011 17:13,4.95,17560.0,United Kingdom
553661,22698,PINK REGENCY TEACUP AND SAUCER,24,5/18/2011 11:59,2.55,13572.0,United Kingdom
550149,22090,PAPER BUNTING RETROSPOT,10,4/14/2011 14:37,2.95,13069.0,United Kingdom
566317,22835,HOT WATER BOTTLE I AM SO POORLY,8,9/12/2011 10:19,4.65,13375.0,United Kingdom
581238,23371,SET 36 COLOUR PENCILS SPACEBOY ,3,12/8/2011 10:53,1.25,,United Kingdom
561504,21361,,-7,7/27/2011 14:15,0.0,,United Kingdom
572134,21277,FRENCH STYLE EMBOSSED HEART CABINET,1,10/21/2011 10:13,21.95,12500.0,Germany
561258,22904,CALENDAR PAPER CUT DESIGN,80,7/26/2011 12:03,2.55,15513.0,United Kingdom
566290,21930,JUMBO STORAGE BAG SKULLS,2,9/11/2011 15:24,2.08,14456.0,United Kingdom
577406,22835,HOT WATER BOTTLE I AM SO POORLY,4,11/20/2011 10:36,4.95,12702.0,Germany
538349,22173,METAL 4 HOOK HANGER FRENCH CHATEAU,2,12/10/2010 14:59,5.91,,United Kingdom
573578,21820,GLITTER HEART GARLAND WITH BELLS ,12,10/31/2011 14:13,3.75,16018.0,United Kingdom
544770,22570,FELTCRAFT CUSHION RABBIT,1,2/23/2011 11:11,7.46,,United Kingdom
568657,23371,SET 36 COLOUR PENCILS SPACEBOY ,3,9/28/2011 12:22,1.25,16460.0,United Kingdom
567085,21194,PINK  HONEYCOMB PAPER FAN,12,9/16/2011 12:38,0.65,12434.0,Australia
577358,22810,SET OF 6 T-LIGHTS SNOWMEN,1,11/18/2011 15:59,5.79,,United Kingdom
577078,21125,SET 6 FOOTBALL CELEBRATION CANDLES,1,11/17/2011 15:17,1.25,,United Kingdom
567818,84912A,PINK ROSE WASHBAG,8,9/22/2011 12:41,3.75,14395.0,United Kingdom
548169,20914,SET/5 RED RETROSPOT LID GLASS BOWLS,8,3/29/2011 13:48,2.95,14680.0,United Kingdom
572896,85049E,SCANDINAVIAN REDS RIBBONS,12,10/26/2011 14:41,1.25,12456.0,Switzerland
574258,22086,PAPER CHAIN KIT 50'S CHRISTMAS ,1,11/3/2011 13:50,2.95,16891.0,United Kingdom
565726,23340,VINTAGE CHRISTMAS CAKE FRILL,12,9/6/2011 11:58,1.65,14360.0,United Kingdom
550474,16207A,PINK STRAWBERRY HANDBAG ,1,4/18/2011 13:58,3.29,,United Kingdom
547547,20619,TROPICAL PASSPORT COVER ,3,3/23/2011 15:30,1.63,,United Kingdom
547656,21122,SET/10 PINK POLKADOT PARTY CANDLES,1,3/24/2011 12:53,1.25,13263.0,United Kingdom
579941,21497,FANCY FONTS BIRTHDAY WRAP,25,12/1/2011 10:31,0.42,16496.0,United Kingdom
537144,21900,"KEY FOB , SHED",2,12/5/2010 13:00,0.65,15880.0,United Kingdom
537823,90096,NECKLACE+BRACELET SET BLUE BLOSSOM,2,12/8/2010 14:25,2.51,,United Kingdom
552975,79000,MOROCCAN TEA GLASS,12,5/12/2011 13:58,0.85,17932.0,United Kingdom
568782,22329,ROUND CONTAINER SET OF 5 RETROSPOT,12,9/29/2011 8:53,1.65,13985.0,United Kingdom
564958,23254,CHILDRENS CUTLERY DOLLY GIRL ,8,8/31/2011 13:56,4.15,13089.0,United Kingdom
